,S.No.,tweetid,tweettext
0,1,jeremyphoward,"Proud to be launching ""Introduction to Machine Learning for Coders"" today. If you're looking for a modern, code-first, opinionated introduction to machine learning, I think you might like this.  http://www.fast.ai/2018/09/26/ml-launch/ … pic.twitter.com/PxuEAU0c4V"
1,2,oriolvinyalsml,"Interesting papers using  http://github.com/deepmind/pysc2  showing the difficulty of StarCraft2 1vs1 for Deep RL (even w/ handcrafting & simplifications):  http://arxiv.org/abs/1809.09095 ,  http://arxiv.org/abs/1809.07193   Note that Blizzard AIs are easy to beat as human. Looking forward to more progress! pic.twitter.com/iHIIW5WSy8"
2,3,karpathy,"A report on the geopolitics of AI by @timhwang, especially found Part 3 interesting  https://arxiv.org/abs/1803.08971 , and the highly related ""U.S. Semiconductor Manufacturing: Industry Trends, Global Competition, Federal Policy""  https://fas.org/sgp/crs/misc/R44544.pdf …"
3,4,karpathy,"Growing as a programmer is to a large extent the accumulation of scars in your mind, which burn with each new line of code proportional to the expected pain inflicted on your future self over all possible refactoring."
4,5,karpathy,“The state of the art in explanation of a concept” - a phrase I first heard in a chat with @3blue1brown a while ago but has lingered with me since. Why shouldn’t there be an effort to seek/recognize such a thing for all concepts
5,6,karpathy,"My morning coffee turned out to be the difference between going and not going to NIPS 2018 this year. Apparently sold out in <15 minutes. I laughed at this diagram a year ago, but today it is too real. https://twitter.com/soumithchintala/status/909057642731130880 …"
6,7,karpathy,"Available video speeds on YouTube: 0, 0.25, 0.5, 0.75, 1.0, 1.25, 1.5, 2.0. What monster left out the 1.75x"
7,8,karpathy,“A Magazine Is an iPad That Does Not Work”  https://youtu.be/aXV-yaFmQNk  a fave video. As our technosphere becomes more advanced & pervasive it is increasingly difficult to distinguish it from raw physics. Eg one day it will be odd that there was a time you couldn’t talk to all objects
8,9,karpathy,Full Body Surrogacy for Collaborative Communication  https://www.youtube.com/watch?v=Nrc7gH6dydw … interesting
9,10,pytorch,"We're excited to host the first PyTorch Developer Conference, featuring talks, discussions and posters from the core-devs, academia and industry.  Date: Oct 2nd, 2018 in San Francisco.  Space is limited, apply for an invite at  https://pytorch.fbreg.com "
10,11,karpathy,"""Hybrid Optical-Electronic Convolutional Neural Networks""  http://www.computationalimaging.org/publications/hybrid-optical-electronic-convolutional-neural-networks/ … incredibly interesting work - develops a hybrid optoelectronic CNN with an optical CONV1 layer that operates at zero power consumption (with rest of the forward pass in electronics (for now))"
11,12,karpathy,"There was an interestingly prophetic short story that has left a lasting impression on me and now can’t find. It’s few decades old and describes a highly accelerated future with people going through multiple jobs, partners, and rich and bankrupt cycles each day. Rings any bells?"
12,13,jhnhw,"First 1e6 integers, represented as binary vectors indicating their prime factors, and laid out using the sparse matrix support in @leland_mcinnes's UMAP dimensionality reduction algorithm. This is from a 1000000x78628 (!) binary matrix. Very pretty structure emerges. pic.twitter.com/PF6slS2EO3"
13,14,ericjang11,"Incredible style pose transfer + generative models paper applied to dance videos. This is so cool, my fingers are trembling as I tweet this.  https://youtu.be/PCBTZh41Ris?t=2m13s … Paper:  https://arxiv.org/pdf/1808.07371.pdf …"
14,15,pytorch,"Try out @NvidiaAI 's Vid2Vid project for photorealistic video-to-video translation, synthesizing label maps to realistic videos, people talking from edge maps, or generating human motions from poses Now supports the latest PyTorch v0.4.1:  https://github.com/NVIDIA/vid2vid  pic.twitter.com/XVu0vGQnLr"
15,16,karpathy,Great post exploring the details of one of the first few programs. https://twobithistory.org/2018/08/18/ada-lovelace-note-g.html …
16,17,karpathy,Discovering (paradoxically late in life) that I get more out of textbooks than books and that I don’t have to stop buying them just because I’m out of school. Good reading list pointers: https://www.lesswrong.com/posts/xg3hXCYQPJkwHyik2/the-best-textbooks-on-every-subject …
17,18,elonmusk,Tesla deliveries & AP hardware chart by @lexfridman at MIT pic.twitter.com/6vZxKMcec2
18,19,karpathy,"@OpenAI Was quite fun watching the OpenAI Five match earlier today, despite my limited awareness of DOTA macro strategy. Silicon beat meat 2-1, (1 with hero draw handicap). Congrats team at @openai on win & fun event! pic.twitter.com/HIYkSKp7gF"
19,20,karpathy,"""An Empirical Evaluation of Generic Convolutional and Recurrent Networks for Sequence Modeling""  https://arxiv.org/abs/1803.01271  good to see more papers on the topic - always start with a CNN before reaching for an RNN. You'll be surprised with how far you can get."
20,21,karpathy,"The latest entry in turning ImageNet into MNIST: 75.8% top-1 test accuracy with ResNet-50 (90 epochs) in 6.6 minutes using 2048 Tesla P40 GPUs  https://arxiv.org/abs/1807.11205  64K ""mini""-batch size, mixed precision training, LARS, BN&bias weight decay at zero, custom all-reduce"
21,22,nathanbenaich,"#AI newsletter, State of AI 2018 edition, coming out tomorrow. Drop your deets here to get it straight to your 📥 http://www.nathan.ai "
22,23,karpathy,That deeply soul crushing feeling when you're super excited to try out this new thing you just impulse bought only to discover that batteries are not included. To add insult to injury sometimes manufacturers go the extra mile and require you to also remove screws to install them.
23,24,ericjang11,"""There are exactly four normed division algebras: the real numbers (R), complex numbers (C), quaternions (H), and octonions (O). "" I really love when @QuantaMagazine goes in depth on more obscure and under-appreciated fields. Real investigative journalism!  https://www.quantamagazine.org/the-octonion-math-that-could-underpin-physics-20180720 … pic.twitter.com/frv1dU5NoM"
24,25,patrickc,"While @elonmusk is in the headlines for many reasons these days, this particular chart probably doesn’t get enough attention. 10 years after founding, SpaceX had ~0% market share. 16 years: >50%. pic.twitter.com/uBMEj2Y9P6"
25,26,karpathy,Fantastic set of videos on building a programmable 8-bit computer from scratch on breadboards using only simple logic gates  https://eater.net/  & direct link to playlist https://www.youtube.com/watch?v=HyznrdDSSGM&list=PLowKtXNTBypGqImE405J2565dvjafglHU …
26,27,karpathy,It took me a while to really admit to myself that just reading a book is not learning but entertainment.
27,28,petewarden,There are some fantastic links on neural network acceleration hardware in this CS217 syllabus:  https://cs217.github.io/  - thanks @perdavan and Kunle Olukotun!
28,29,hardmaru,"An Intriguing Failing of Convolutional Neural Networks and the CoordConv Solution, from UberAI. Adding CPPN-style coordinate information actually complements and improves spatial-invariant property of ConvNets. Includes a TF implementation in the Appendix.  https://arxiv.org/abs/1807.03247  pic.twitter.com/y7FEQkF7No"
29,30,dpkingma,"Check out  https://blog.openai.com/glow/ , my work with @prafdhar on improving flow-based generative models with invertible 1x1 convolutions.  https://youtu.be/exJZOC3ZceA  pic.twitter.com/2aF95mNFEG"
30,31,alexis_b_cook,"The official repository for the Deep Reinforcement Learning Nanodegree program at @udacity is now public!  Check it out to see many implementations in @PyTorch, including DQN, DDPG, and much more!  https://bit.ly/2NyHY5M  pic.twitter.com/Be5UAILQ6l"
31,32,karpathy,The quest for optimal normalization in neural nets continues. SwitchNorm: add BatchNorm + InstanceNorm + GroupNorm with a learnable blend at each layer  https://arxiv.org/abs/1806.10779  fun plots; + code https://github.com/switchablenorms/Switchable-Normalization …
32,33,goodfellow_ian,"This new family of GAN loss functions looks promising! I'm especially excited about Fig 4-6, where we see that the new loss results in much faster learning during the first several iterations of training. I implemented the RSGAN loss on a toy problem and it worked well. https://twitter.com/jm_alexia/status/1014101054156431360 …"
33,34,jaschasd,"Adversarial Reprogramming of Neural Networks  https://goo.gl/qnB5FA  A new goal for adversarial attacks! Rather than cause a specific misclassification, we force neural networks to behave as if they were trained on a completely different task! With @gamaleldinfe, @goodfellow_ian pic.twitter.com/1Wj8aOIHn5"
34,35,ericjang11,New blog post in which I share my thoughts on the ICRA conference & state of robotics research!  https://blog.evjang.com/2018/06/icra2018.html …
35,36,karpathy,most common neural net mistakes: 1) you didn't try to overfit a single batch first. 2) you forgot to toggle train/eval mode for the net. 3) you forgot to .zero_grad() (in pytorch) before .backward(). 4) you passed softmaxed outputs to a loss that expects raw logits. ; others? :)
36,37,karpathy,Scalable Deep Reinforcement Learning for Robotic Manipulation  https://ai.googleblog.com/2018/06/scalable-deep-reinforcement-learning.html … hand-designed init -> 580k grasp attempts on 7 robot arms over 4 months (raw monocular RGB camera input) -> 1.2M param net -> 96% successful test set grasps pic.twitter.com/zn2EyrKYZy
37,38,karpathy,would be interesting to see a strategy game (e.g. Starcraft/DOTA) match mode with focus on strategy & taking out agility. E.g. slow down game 20x so battles can be easily micro'd on human time scales (?). related discussion in http://www.gamesbyangelina.org/2018/06/good-luck-have-fun/ …
38,39,karpathy,"Fun project request following up on last tweet: visually render in 3D code bases (git repos) to look like construction / factory. Modules become sites, topology follows function calls, compute becomes movement, developers swarm around in yellow hats building it..."
39,40,robjheaton,"I've been working on a system to remember more of what I read. It’s obviously not the result of years of (or indeed any) scientific verification, but I have found it to be quite effective. https://robertheaton.com/2018/06/25/how-to-read/ …"
40,41,karpathy,"Spent some time at the factory last night. Felt like Alice in Wonderland, except with Wonderland as the home planet of the Transformers. I love software, but editing text files at a computer is nowhere near as viscerally overwhelming."
41,42,ajmooch,"DARTS: Differentiable Architecture Search by Hanxiao Liu, Karen Simonyan, and Yiming Yang.  They operate on a continuous relaxation of the search space, and gradient descent their way to top performance in ~1 GPU day!  Paper:  https://arxiv.org/abs/1806.09055  Code:  https://github.com/quark0/darts  pic.twitter.com/VdjnRZHpjz"
42,43,openai,"Our team of five neural networks, OpenAI Five, has started to defeat amateur human teams (including a semi-pro team) at Dota 2: https://blog.openai.com/openai-five/ "
43,44,devonzuegel,San Francisco has... 👪 884k people 🚗 497k vehicles 🅿️ 275k parking spaces   https://www.dmv.ca.gov/portal/wcm/connect/add5eb07-c676-40b4-98b5-8011b059260a/est_fees_pd_by_county.pdf?MOD=AJPERES …
44,45,karpathy,"Congratulations Reddit for being one of the most annoying websites begging you to download the app when there is zero need for it. Your perseverance, invasiveness, UI trickery and changing tactics have fooled me a number of times to accidentally click on the app link. 👏 10/10"
45,46,janexwang,Dissolving the Fermi paradox. What a way to end a paper - Conclusion: Loneliness and existential ennui.  https://arxiv.org/abs/1806.02404  pic.twitter.com/4x5CqQGa9o
46,47,nvidiaaidev,"@nvidia Today at #CVPR2018 we introduce @NVIDIA DALI & nvJPEG, new #deeplearning libraries for data augmentation and image decoding.  https://nvda.ws/2JNmsfI  pic.twitter.com/OAvs7ixpMl"
47,48,karpathy,"Was very fun to bring Tesla to #cvpr2018, in style. With the Model X at our booth I think we accidentally sold a few cars :) pic.twitter.com/0m6vOA79qK"
48,49,davidduvenaud,"@jessebett Neural ODEs: Instead of updating hiddens layers by layer, we specify their derivative wrt depth with a neural network.  An ODE solver adaptively computes the output. By amazing students @rtqichen @YuliaRubanova @JesseBett.  https://arxiv.org/abs/1806.07366  pic.twitter.com/3C0FmKpxuS"
49,50,reza_zadeh,"Best paper award at #CVPR2018 main idea: study twenty five different visual tasks to understand how & when transfer learning works from one task to another, reducing demand for labelled data.   Paper:  https://arxiv.org/pdf/1804.08328.pdf … Data:  http://taskonomy.stanford.edu  pic.twitter.com/Ya0jAGh5pp"
50,51,pabbeel,"@WeightsB Very excited to announce something we’ve been working on for a while now:  https://fullstackdeeplearning.com/  3-day bootcamp!  Instructors: @sergeykarayev (@gradescope), @josh_tobin_ (Berkeley/OpenAI), @karpathy (Tesla), Jai Ranganathan (Uber), Yangqing Jia (FB), @l2k (@weightsb), @pabbeel"
51,52,evolvingstuff,"More of this kind of thing, please.  A Connectome Based Hexagonal Lattice Convolutional Network Model of the Drosophila Visual System  https://arxiv.org/abs/1806.04793  pic.twitter.com/ZhNoEk0f84"
52,53,karpathy,"Through-Wall Human Pose Estimation Using Radio Signals  http://rfpose.csail.mit.edu/   ""wireless signals in the WiFi frequencies traverse walls and reflect off the human body. It uses a deep neural network approach that parses such radio signals to estimate 2D poses."""
53,54,karpathy,"#randomscifisundays Exhalation, from Ted Chiang  http://www.lightspeedmagazine.com/fiction/exhalation/ … steampunk spin on heat death of the Universe"
54,55,karpathy,Jeff Bezos @ ISDC 2018 https://www.geekwire.com/2018/jeff-bezos-isdc-space-vision/ …
55,56,lukasheinrich_,We just deployed a high-energy physics version of @karpathy's  @arxiv_org-sanity interface at @CERN on  https://arxivsanity.web.cern.ch/  -- still indexing. @JannickePS @KyleCranmer pic.twitter.com/o7iTFtD5bz
56,57,petewarden,"Why you need to improve your training data, and how to do it: https://petewarden.com/2018/05/28/why-you-need-to-improve-your-training-data-and-how-to-do-it/ …"
57,58,karpathy,"lots of exciting recent work in large-scale distributed training of neural nets: (very) large-batch SGD, KFAC, ES, population-based training / ENAS, (online) distillation, ... 🔥"
58,59,karpathy,"not a huge fan of the term ""differentiable programming"". The big deal isn't that it's differentiable, it's that there is any optimization over the code at all, instead of explicit code. I like/started to use ""fill-in-the-blanks programming"", artifacts of which are Software 2.0 :)"
59,60,karpathy,"Searching for a place in some vicinity of Bay Area, pretty, quiet, with WiFi, ability to sit down for few hours and read/work. I know it exists somewhere out there."
60,61,openai,"Releasing Gym Retro — 1000+ games for reinforcement learning research, plus an integrator tool to add your own classic games.  https://blog.openai.com/gym-retro/  pic.twitter.com/kRbtvsOubi"
61,62,hardmaru,Generative Ramen https://twitter.com/prostheticknowl/status/998663860746948608 …
62,63,karpathy,"Good recent episode on Rationally Speaking podcast on one of my favorite subreddits, r/changemyview ( https://www.reddit.com/r/changemyview/ ).  Mentions a 2016 paper on the sub:  https://chenhaot.com/papers/changemyview.html …"
63,64,neurograce,"Ok, it's done: Fifteen questions and answers about the use of convolutional neural networks as a model of the visual system. My magnum opus! https://neurdiness.wordpress.com/2018/05/17/deep-convolutional-neural-networks-as-models-of-the-visual-system-qa/ …"
64,65,karpathy,"Towards battery-free HD video streaming  http://batteryfreevideo.cs.washington.edu/  ""we can harvest sufficient energy to enable battery-free 30 fps 1080p video streaming at up to 8 feet."" Backscatter is on a roll, for better or worse, and mix of both."
65,66,elonmusk,Tesla quarterly all-hands video. Love the shot of wild horses & Giga in winter https://m.youtube.com/watch?feature=youtu.be&v=azUbCdcAeFM …
66,67,sydonahi,"We rely on 15 people to do our science. Without them matplotlib, numpy and pandas would not be maintained. pic.twitter.com/6shDUknJMx"
67,68,karpathy,"Duplexes talking to duplexes would be an amusing use of existing (human) interfaces but by AIs. Just like autonomous cars use existing roads/signs for humans, or how our ""world of bits"" AI at OpenAI used simulated keyboard/mouse events to interact with web pages. Very amusing."
68,69,ylecun,"We are releasing ELF OpenGo, a go bot that has attained professional level in two weeks of training and has won 15 games against 4 top professional human players.  This uses the ELF platform for distributed RL and is released with source code and...  https://www.facebook.com/yann.lecun/posts/10155258618417143 …"
69,70,phillip_isola,Nonparametric image synthesis has gone out of fashion but this paper shows that it can still do amazing things when combined with deep nets to clean things up:  https://arxiv.org/abs/1804.10992   Amazing how much results have improved in just the last 1.5 years: https://www.youtube.com/watch?v=U4Q98lenGLQ …
70,71,jeremyphoward,Training Imagenet in 3 hours for $25; and CIFAR10 for $0.26 ·  http://fast.ai   http://www.fast.ai/2018/04/30/dawnbench-fastai/ …
71,72,karpathy,"Great to see roadmap for production support in PyTorch and, very importantly, on strictly opt-in basis 👍. The feature/attribute tradeoffs you'd like from a good DL framework vary between workflows quite a lot (~ debugging/dev, training @ scale, inference @ scale) https://twitter.com/PyTorch/status/991727733846650880 …"
72,73,cnancyxu,"so @gradientpub launched today 🎉  Weekly publications on cutting-edge topics in #AI by academic and industry researchers. Would recommend joining the community, lots of room to contribute, & share feedback!   >  https://thegradient.pub/  https://twitter.com/gradientpub/status/991205576293076993 …"
73,74,karpathy,"PyTorch 0.4.0 is out!  https://github.com/pytorch/pytorch/releases/tag/v0.4.0 … lots of welcome additions: Variables/Tensor merge, more numpy-likeness (dtypes, *_like, pro indexing...), much easier to write CPU/GPU agnostic code, gradient checkpointing for memory-efficient backprop, reduce=False, distributions 👏"
74,75,nickgrossman,"John Oliver on cryptocurrencies: ""everything you don't understand about money combined with everything you don't understand about computers"". priceless. https://www.youtube.com/watch?v=g6iDZspbRMg …"
75,76,karpathy,Delighted to stumble by this article bringing more attention to Stanislaw Lem and his work. Very high ratio of intellectual depth vs obscurity. http://m.nautil.us/issue/28/2050/the-book-no-one-read …
76,77,karpathy,"1 hour and 5 diagrams later I optimized 100 lines of code that ran in 13 seconds to 20 lines of heavily vectorized code that runs in 0.02 seconds, and this might just be the best day of my life, so far."
77,78,karpathy,"The QC-1 ""Crypto heater"" doesn't waste entropy, heats your house while mining ETH, pays for itself in ~5 years https://www.theverge.com/circuitbreaker/2018/3/9/17100068/qarnot-qc-1-cryptocurrency-mining-rig-heater-home-electricity-ethereum …"
78,79,pabbeel,"Existing RL methods can be adapted to learn robust control policies capable of imitating a broad range of example motion clips, while also learning complex recoveries.  https://www.youtube.com/watch?v=vppFvq2quQ0 … paper:  https://arxiv.org/abs/1804.02717  w/ @jasonpeng0 Sergey Levine @Mvandepanne"
79,80,karpathy,"Another fun entry joins the growing ""RL Anonymous"" collection, documenting 8 months of trying to get RL to work  http://amid.fish/reproducing-deep-rl … reminded of my contribution to the collection from ~year ago in HN comments:  https://news.ycombinator.com/item?id=13519044 …"
80,81,karpathy,"Got a chance to try out a Bird ( https://www.inc.com/will-yakowicz/the-bird-electric-scooter-phenomenon.html …) this morning and it is THE BEST. Waiting for someone to photoshop it as the next stage into one of those ""evolution of man"" pictures."
81,82,minimaxir,My weekend project: automatically block people in images (like in Black Mirror) using a pretrained neural network.   https://github.com/minimaxir/person-blocker … pic.twitter.com/0EgFBh9MEX
82,83,karpathy,"""As We May Think"" Vannevar Bush in 1945 trying to predict future  https://www.theatlantic.com/amp/article/303881/ … ""A memex is a device in which an individual stores all his books, records, and communications, [...] it may be consulted with exceeding speed and flexibility. [...] supplement to his memory."""
83,84,tesla,Model 3 is Popular Mechanics’ Car of the Year https://www.popularmechanics.com/cars/g19605464/best-cars-2018/ …
84,85,karpathy,"Haha, ""YOLOv3: An Incremental Improvement""  https://pjreddie.com/media/files/papers/YOLOv3.pdf … reads like good stand up comedy"
85,86,karpathy,I’ve resisted Civilization IV: Rise and Fall expansion for almost a month and a half now. This morning after an article I thought I’ll check it out for just one game. But I know where that path leads. I must stay strong.
86,87,hardmaru,"""Simple random search provides a competitive approach to reinforcement learning"", by Mania, Guy and @beenwrekt Paper:  https://arxiv.org/abs/1803.07055  Code:  https://github.com/modestyachts/ARS … Blog: http://www.argmin.net/2018/03/20/mujocoloco/ …"
87,88,karpathy,"""Alexa, turn on the light!"". ""A few devices share that name, which one do you want?"". ""Living room"". ""A few devices share that name, which one do you want?"" ""Ohhh, shut up"". ""This device is not responding"". Just a regular day in a life of Alexa."
88,89,karpathy,It's very rewarding to watch the early feedback on our latest Autopilot update:  https://electrek.co/2018/03/16/tesla-autopilot-update-first-drive-videos/ … a result of a fairly extensive rewrite. Working hard to get more of it polished and out there!
89,90,karpathy,"If you squint a bit academia is a kind of blockchain. Each paper is a transaction, a block is a conference. The reviewers determine if a block is valid (except with effectively zero ""mining"" reward :\). Paper citations are pointers to the previous block(s). Maybe? no? okay"
90,91,evolvingstuff,"Highly recommend this paper for practitioners of / those with an interest in Evolutionary Computation and Artificial Life. Overview of the many ways that evolution will ""cheat"" and hack its way around your oh-so-clever reward function!  https://arxiv.org/abs/1803.03453  pic.twitter.com/k82MR5Kuk1"
91,92,karpathy,"Idea for a ""metalearning-chess"" variation: keep the dynamics the same but make the reward function for each game be some (fixed) random function of the game board (e.g. a random linear or a depth 2 regression tree) that the players observe a sample from at end of their turn."
92,93,karpathy,It is starting to look like deep learning workflows of the future feature autotuned architectures running with autotuned compute schedules across arbitrary backends. I don't know if I should be excited or scared.
93,94,karpathy,"I lack a tool to ""lay out"" image/text information visually. Like a word doc but not just linearly downwards, but all around on a large 2D plane, with ability to zoom in/out, etc. Really doubt that we've reached anywhere close to the peak of UI tooling for the brain."
94,95,karpathy,"Unique mentions of deep learning frameworks in arxiv papers (full text) over time, based on 43K ML papers over last 6 years. So far TF mentioned in 14.3% of all papers, PyTorch 4.7%, Keras 4.0%, Caffe 3.8%, Theano 2.3%, Torch 1.5%, mxnet/chainer/cntk <1%. (cc @fchollet) pic.twitter.com/YOYAvc33iN"
95,96,sedielem,"""We conclude that the common association between sequence modeling and recurrent nets should be reconsidered, and convolutional nets should be regarded as a natural starting point for sequence modeling tasks."" Great to see more work in this direction!  https://arxiv.org/abs/1803.01271  pic.twitter.com/Xi7SJ7FPat"
96,97,pytorch,Tensor Comprehensions are now integrated and interoperable with @PyTorch . Read our blog post to get started:  http://pytorch.org/2018/03/05/tensor-comprehensions.html … https://twitter.com/soumithchintala/status/963823615803379712 …
97,98,nathanbenaich,"Your guide to AI in Q4 2017, straight from ☃️ London! Check it out below 👇 https://www.getrevue.co/profile/nathanbenaich/issues/your-guide-to-ai-in-q4-2017-by-nathan-ai-78767 …"
98,99,karpathy,"Google Search trends: Deep Learning vs. Bitcoin. Search traffic is not the best proxy, but I find it interesting that so many of my friends in AI, when asked to guess, guess this relationship consistently waaay off. pic.twitter.com/ZoRiaRedHm"
99,100,rivatez,this is a much more accurate depiction of silicon valley culture than all this bro stuff https://m.sfgate.com/business/article/The-Silicon-Valley-elite-s-latest-status-symbol-12723431.php#item-85307-tbla-72 …
100,101,goodfellow_ian,4 years of GAN progress (source:  https://www.eff.org/files/2018/02/20/malicious_ai_report_final.pdf … ) pic.twitter.com/kmK5zikayV
101,102,karpathy,"miniaturization, decreasing hardware costs and intelligence at the edge. starts to look a bit like the beginning of a synthetic Cambrian explosion https://twitter.com/Harvard/status/967759846257733635 …"
