,S.No.,tweetid,tweettext
102,103,karpathy,"this find has made my day: ""The Progress of Invention in the Nineteenth Century"", written in 1900.  https://www.gutenberg.org/files/41538/41538-h/41538-h.html …"
103,104,karpathy,My email app icon badge shows that I have 1 unread email but when I open it I can’t see/find it. Hashtag the struggles of modern age :’(
104,105,hardmaru,"@beenwrekt ""Policy gradient is nothing more than random search dressed up in mathematical symbols and lingo."" 🔥🔥🔥 Another excellent article about RL, by @BeenWrekt. http://www.argmin.net/2018/02/20/reinforce/ …"
105,106,poolio,speech cloning + few shot image generation = unlimited fake video content of anyone doing anything. deepfakes was just the tip of the iceberg. https://twitter.com/BaiduResearch/status/966102801792122880 …
106,107,petewarden,Blue Pill: A 75MHz 32-Bit Computer for $2! https://petewarden.com/2018/02/21/blue-pill-a-75mhz-32-bit-computer-for-2/ …
107,108,projectjupyter,🎉 JupyterLab is Ready for Users 🎉 https://blog.jupyter.org/jupyterlab-is-ready-for-users-5a6f039b8906 …
108,109,karpathy,"seeing self-attention (a kind of global ""message passing"" operation) popping up in a number of places recently, following ""attention is all you need"" paper ( https://arxiv.org/abs/1706.03762 ) for MT. e.g., recently  https://arxiv.org/abs/1711.07971 ,  https://openreview.net/forum?id=r16Vyf-0- … etc."
109,110,karpathy,SysML (a new systems + machine learning conference) happening today @ Stanford + live stream available http://www.sysml.cc/ 
110,111,soumithchintala,"Tensor Comprehensions: einstein-notation like language transpiles to CUDA, and autotuned via evolutionary search to maximize perf. Know nothing about GPU programming? Still write high-performance deep learning. @PyTorch integration coming in <3 weeks.  https://research.fb.com/announcing-tensor-comprehensions/ … pic.twitter.com/ucbBMRZQPN"
111,112,carpedm20,"PyTorch implementation of ""Efficient Neural Architecture Search via Parameters Sharing"" from Google Brain  https://github.com/carpedm20/ENAS-pytorch … #PyTorch pic.twitter.com/bTnojsV4VC"
112,113,karpathy,"""Deep Reinforcement Learning Doesn't Work Yet""  https://www.alexirpan.com/2018/02/14/rl-hard.html … great read, hits a lot of points I've also come to realize over last ~2 years. 70% is a vast understatement."
113,114,karpathy,"Quite like the pedagogy of this visual, concrete, example-driven, ""live demo"" approach to a blockchain tutorial  https://anders.com/blockchain "
114,115,skydiohq,"This is Skydio R1 Frontier Edition: a self-flying camera that knows what to film and flies itself to get the best shot, letting you capture otherwise impossible videos of your adventures.  Learn more at  http://www.skydio.com  pic.twitter.com/PkS5Ukisp4"
115,116,karpathy,"neat, ICLR 2018 papers sorted by their score  https://chillee.github.io/OpenReviewExplorer/index.html … would be fun to see it sorted by score ""entropy"" too, those papers can be quite good."
116,117,karpathy,New Boston Dynamics video is making rounds  https://www.youtube.com/watch?v=fUyU3lKzoio … looks very cool! Just a bit worried that behind the scenes is a team of people over the last few months carefully crafting a full state machine for this demo.
117,118,karpathy,"It looks like if you bombard Earth with photons for a while, it can emit a Roadster. hah"
118,119,karpathy,There is a Roadster in space. And it has a live feed:  https://www.youtube.com/watch?v=aBr2kKAHN6M … definitely the fastest car :) pic.twitter.com/2XR05bg1ON
119,120,elonmusk,"View from SpaceX Launch Control. Apparently, there is a car in orbit around Earth. pic.twitter.com/QljN2VnL1O"
120,121,spacex,Falcon Heavy side cores have landed at SpaceX’s Landing Zones 1 and 2. pic.twitter.com/oMBqizqnpI
121,122,spacex,Liftoff! pic.twitter.com/2ypESsi1sF
122,123,oriolvinyalsml,Evolution > RL (for now...) for architecture search. New SOTA on CIFAR10 (2.13% top 1) and ImageNet (3.8% top 5). 🔥 450 GPU / 7 days & 900 TPU / 5 days 🔥  https://arxiv.org/abs/1802.01548  pic.twitter.com/VgX1pUiqWX
123,124,elonmusk,Falcon Heavy sends a car to Mars https://youtu.be/Tk338VXcb24 
124,125,karpathy,"Getting fairly addicted to Anki as a result of this twitter thread from @michael_nielsen & few posts I've encountered in the past  https://www.gwern.net/Spaced-repetition …. Was easier than I expected to learn lots of countries/states/flags. Wish there were more ""open-sourced"" anki decks out there. https://twitter.com/michael_nielsen/status/957763229454774272 …"
125,126,karpathy,The Secret Life of Plankton  https://youtu.be/xFQ_fO2D7f0  i still can't quite wrap my head around our laws of physics apparently just resulting in the whole party
126,127,pabbeel,"ICLR accepted paper analysis by Arthur Pajot.  Berkeley coming in second after Google, followed by Stanford, CMU, Facebook, Microsoft, Oxford, IBM, Toronto, ETH, MIT, ...  Many other breakdowns, too + code  http://webia.lip6.fr/~pajot/dataviz.html … pic.twitter.com/mrNU0rxick"
127,128,karpathy,My iPhoneX switch has turned out to be a UX regression: - Face ID doesn't work: when phone is on table next to me. when I try to check it from bed in am hours. halfway through a yawn. leaning on my hand. - Often accidentally swipe to camera when I play with the phone in my hand
128,129,karpathy,DNA seen through the eyes of a coder  https://ds9a.nl/amazing-dna/  I like this a lot.
129,130,gwern,Best of 2017 links:  https://www.gwern.net/newsletter/2017/13 …
130,131,karpathy,"Instead trying to describe an architecture in a paper with words, tables and diagrams across 2 sections and 4 pages, it is 90% of the time possible to just paste the 100 lines of code into Appendix A."
131,132,pytorch,"We are a year old :) A post looking back at our journey, the lovely community, the engineering and love.  http://pytorch.org/2018/01/19/a-year-in.html …"
132,133,karpathy,UC Berkeley EECS Colloquium talk on GraphCore's Colossus IPU https://www.youtube.com/watch?v=7XtBZ4Hsi_M …
133,134,karpathy,"faster-rcnn.pytorch  https://github.com/jwyang/faster-rcnn.pytorch … object detection is deceivingly highly error-prone, tricky, and labor intensive to get right. Great to see nice, open source, and evaluated implementations."
134,135,cademetz,"How big is the sudden explosion of startups building AI chips? There are 45 of them, and at least five have raised $100 million: https://nyti.ms/2EEpICX "
135,136,hardmaru,KaTeX is so much better than MathJax  https://khan.github.io/KaTeX/ 
136,137,karpathy,"A long while ago I came across a great document describing the human brain strictly as a computing device, from a computer scientist / systems perspective. Can't find anymore ;( (trying to Google it is only surfacing Neuralink news articles...)"
137,138,karpathy,Reading Silicon: How to Reverse Engineer Integrated Circuits  https://www.youtube.com/watch?v=aHx-XUA6f9g … wow. I felt proud reverse engineering x86 binaries and was unaware of this next level.
138,139,karpathy,"Curiously, the dynamics of this system are such that when you bombard hot earth stuff with photons for a while, it eventually transforms into intricate molecular fractal patterns of vegetation, humans/animals, cities, cars, chips etc. must look funny “zoomed out” & played forward"
139,140,karpathy,"Black Mirror Season 4: 1. ""Hang the DJ"" - fun twist 2. ""USS Callister"" - entertaining but unrealistic 3. ""Arkangel"" - good ""well-intentioned tech gone wrong"" story 4. ""Black Museum"" - trying a bit too hard 5. ""Crocodile"" - well that escalated quickly 6. ""Metalhead"" - yeeeeahno"
140,141,karpathy,Cool analysis (but overall a bit of a missed opportunity) from RescueTime on productivity trends  http://blog.rescuetime.com/225-million-hours-productivity/ … I like the peak productive for software eng chart. (During PhD I did most of my most productive work at 3am. Now forced to adopt normal working hours :( )
141,142,karpathy,Basically everything is rated in range of 3.5-4.2 out of 5.
142,143,oriolvinyalsml,"""Optimal"" running, brought to you by Deep RL.  https://arxiv.org/abs/1801.00690  pic.twitter.com/Sln3HO68Ot"
143,144,dennybritz,I wrote up a (not so brief) summary of AI developments that stood out to me in 2017 http://www.wildml.com/2017/12/ai-and-deep-learning-in-2017-a-year-in-review/ …
144,145,laurademing,Sorry for the late posting! I made a research primer ( http://ldeming.com/longevityfaq ) - would love any feedback/thoughts/comments.
145,146,karpathy,China Shuts Down Its Legal Ivory Trade  https://news.nationalgeographic.com/2017/12/wildlife-watch-china-ivory-ban-goes-into-effect/ … prices of ivory drop 65%. %chance of a good future += 0.0001
146,147,spacex,A Red Car for the Red Planet  http://instagram.com/p/BdA94kVgQhU  pic.twitter.com/440bvUHJeO
147,148,tim_dettmers,@nvidia Deep learning hardware limbo is the battle between @Nvidia vs @AMD vs @IntelNervana for the throne of deep learning hardware. Learn who might win and why  http://timdettmers.com/2017/12/21/deep-learning-hardware-limbo/ … #dlearn #nlproc #ai
148,149,zzznah,My submissions for #nips4creativity are here  http://nips4creativity.com/art/alexander-mordinvtsev/ … pic.twitter.com/KJtnjYViAo
149,150,karpathy,"Visual Domain Decathlon - classify 10 datasets at the same time  http://www.robots.ox.ac.uk/~vgg/decathlon/  a fun setup, brings some problems that are rare in academia but common in industry to the forefront, e.g. large data imbalances, multi-task learning, forgetting, domain adaptation"
150,151,jeffdean,Slides from my talk in yesterday's ML Systems workshop are now up at   http://learningsys.org/nips17/assets/slides/dean-nips17.pdf … #NIPS2017
151,152,jeffdean,"@GoogleResearch If you're interested in learning to do machine learning research, you should investigate the Google AI Residency program.  Applications are due Jan. 8.  @GoogleBrain @googleresearch https://twitter.com/viegasf/status/940424861847080960 …"
152,153,richardsocher, http://johnguerra.co/viz/influentials/NIPS2017/ … Interesting visualization of how much Twitter-based influence/mindshare people/organizations have on the field of #ArtificialIntelligence right now. #NIPS2017 pic.twitter.com/YIHGo98StW
153,154,chrmanning,"Machine Learning just ate Algorithms in one large bite, thx to @tim_kraska, @alexbeutel, @edchi, @JeffDean  & Polyzotis at @Google—faster, smaller trees, hashes, bloom filters  https://www.arxiv-vanity.com/papers/1712.01208v1/ … pic.twitter.com/BcQzOFQrYu"
154,155,fchollet,"My book Deep Learning with Python has been officially released yesterday -- it's now shipping. 384 pages of deep learning, with a crisp smell of freshly printed paper. The coupon code CTWNIPS17 is still active for now (40% off at checkout).  https://www.manning.com/books/deep-learning-with-python?a_aid=keras&a_bid=76564dff … pic.twitter.com/mesC9RXCWd"
155,156,haldaume3,".@ylecun replies to Ali Rahimi's ""alchemy"" and Ali replies to that. v nice!  my opinion is empirical work is great w/o proving things (I do mostly that) but I am quite allergic to the practice of bandage mountains ""just cuz"" for dealing w flaws, rather than going fixing the flaws pic.twitter.com/xMt7UOcKnb"
156,157,ctnzr,"People have been asking for a fast open source CUDA matrix multiplication for ages. My colleagues just released one! In many cases, it’s just as fast as CUBLAS. Works on Volta’s tensor cores, too. https://devblogs.nvidia.com/parallelforall/cutlass-linear-algebra-cuda/ …"
157,158,karpathy,Block-Sparse GPU Kernels release from OpenAI https://blog.openai.com/block-sparse-gpu-kernels/ …
158,159,karpathy,"Some strong results reported in Chess from AlphaZero (an AlphaGo generalization)  https://arxiv.org/abs/1712.01815  winning against a 64 thread 1GB hash Stockfish 28-72-0. Not obvious if it's a comparable ""compute footing"", but the games are fun to step through:  https://lichess.org/study/EOddRjJ8 "
159,160,pytorch,"New release[v0.3.0]: Performance improvements, new layers, ship models to other frameworks (via ONNX), CUDA9, CuDNNv7, lots of bug fixes Read our detailed release notes here:  https://github.com/pytorch/pytorch/releases/tag/v0.3.0 … Install the latest version using updated commands from http://pytorch.org "
160,161,seb_ruder,New blog post: Optimization for Deep Learning Highlights in 2017 http://ruder.io/deep-learning-optimization-2017/index.html …
161,162,karpathy,To friends attending NIPS: we'd like to invite you to our AI fireside chat and party!  Starts at 7pm tonight. If you’d like to join email conversation@tesla.com with your name/affiliation and we’ll do our best to get as many people in as possible! pic.twitter.com/Cth9lrJpss
162,163,karpathy,"HoME: a Household Multimodal Environment  https://home-platform.github.io/  looks pretty cool! vision, audio, semantics, physics, and interaction with objects and other agents & open-source, OpenAI Gym-compatible."
163,164,karpathy,"Wow, GANs are on a roll. Quite amazing results from pix2pixHD:  https://tcwang0509.github.io/pix2pixHD/  Also the most tangible glimpse so far into what I keep referring to as a future Photoshop 2.0"
164,165,goodfellow_ian,"ML researchers, reviewers, and press coverage of ML need to get a lot more serious about statistically robustness of results and the effect of hyperparameters. This study shows that many papers over the last year or so were just observing sampling error, not true improvement. https://twitter.com/karol_kurach/status/935782566291894272 …"
165,166,oriolvinyalsml,Great stuff from @maxjaderberg et al on hyperparameter search based on evolving populations that actually outperforms random search!  https://deepmind.com/blog/population-based-training-neural-networks/ … pic.twitter.com/rgDIU86SuR
166,167,karpathy,Randomly picked up this beauty from an artist on a street market. pic.twitter.com/4fKTcIoOgB
167,168,karpathy,Haha! :) And I thought I'd have to stay in physics if I wanted my own constants. https://twitter.com/fhuszar/status/933683427894841345 …
168,169,tesla, http://Tesla.com/roadster  pic.twitter.com/pyoDmOj4XC
169,170,jackclarksf,Untethered 'Atlas' robot backflip. Pretty incredible stuff from Boston Dynamics.   https://youtu.be/fRj34o4hN4I  pic.twitter.com/Nc8kf7O2gn
170,171,openai,Are you a programmer who wants to get into deep learning? Apply to our Machine Learning Fellow role: https://openai.com/jobs/#lever-54ddfefe-6483-4bba-a828-11a156eae7eb …
171,172,reza_zadeh,The New Computing Stack:  - GPUs/TPUs are eating Linear Algebra. - Linear Algebra is eating Deep Learning. - Deep Learning is eating Machine Learning.  - Machine Learning is eating Artificial Intelligence (AI). - AI is eating Software. - Software is eating the world.
172,173,karpathy,"Very good reading from Rodney Brooks ""The seven deadly sins of predicting the future of AI""  https://rodneybrooks.com/the-seven-deadly-sins-of-predicting-the-future-of-ai …"
173,174,soumithchintala,"use gradient magnitude as a signal for gradient importance.  Sort your gradients, find a threshold, clip your gradients,  exchange sparse gradients, win.  https://openreview.net/pdf?id=SkhQHMW0W … pic.twitter.com/sNChdqCCjm"
174,175,hardmaru,Evolution Strategy Variant + OpenAI Gym pic.twitter.com/t2R0QQ5qcH
175,176,petewarden,Deep Learning is Eating Software -  http://petewarden.com/2017/11/13/deep-learning-is-eating-software/ … - a post inspired by chatting with @karpathy about Software 2.0!
176,177,karpathy,"New blog post: ""Software 2.0"" https://medium.com/@karpathy/software-2-0-a64152b37c35 …"
177,178,quasimondo,Facefeedback II pic.twitter.com/XuFlNWGJ7r
178,179,hnisimasu,Single-molecule movie of DNA search and cleavage by CRISPR-Cas9. pic.twitter.com/3NQxmbvzJF
179,180,sla,"Preferred Networks achieved 74.9% accuracy on ImageNet training in 15min, the world's fastest result using ChainerMN and 1,024 P100 GPUs.  https://www.preferred-networks.jp/en/news/pr20171110 … Paper is available.  https://www.preferred-networks.jp/docs/imagenet_in_15min.pdf …"
180,181,gabormelis,Give your baselines some love and they might surprise you:  https://arxiv.org/abs/1707.05589 
181,182,karpathy,"Google released NASNet in TF a ~week ago, which is exciting  https://github.com/tensorflow/models/tree/master/research/slim/nets/nasnet … the code is a bit difficult to parse but it's nice to have the models. Impressive speed-accuracy tradeoffs."
182,183,ch402,What do neural nets see? You may be surprised. @zzznah @ludwigschubert & I explore.  https://distill.pub/2017/feature-visualization/ … pic.twitter.com/9uOL6uF2HA
183,184,jeremyphoward,Very handy reference to relative Imagenet performance of many recent architectures  https://github.com/Cadene/pretrained-models.pytorch … pic.twitter.com/DD5ui1lsgS
184,185,karpathy,"TensorFlow Eager  https://research.googleblog.com/2017/10/eager-execution-imperative-define-by.html … now more like Chainer, as a response to PyTorch"
185,186,hardmaru,Mixup: Beyond Empirical Risk Minimization. Use random linear interpolation for data & labels to increase robustness of network. Clever idea! pic.twitter.com/fYoEYJTlFN
186,187,karpathy,Efficient Processing of Deep Neural Networks: A Tutorial and Survey  https://arxiv.org/abs/1703.09039  good reading.
187,188,karpathy,"""Why Snapchat Spectacles failed""  https://news.ycombinator.com/item?id=15576751 … I had both Google Glass & Spectacles. They were ""pretty cool"", like VR, Kinect etc."
188,189,quasimondo,Looks like nobody reads the README. There is a 1 hour clip of @nvidias's generated faces with just 166 views: https://www.youtube.com/watch?v=36lE9tV9vm0 …
189,190,karpathy,"""DeepLearning11: 10x NVIDIA GTX 1080 Ti Single Root Deep Learning Server."" That's a lot of firepower for $16K https://www.servethehome.com/deeplearning11-10x-nvidia-gtx-1080-ti-single-root-deep-learning-server-part-1/#comments …"
190,191,karpathy,"There are only a few things that compete for top spots on my ""what would I do with an exaflop computer"". This is now up there."
191,192,karpathy,0_o pic.twitter.com/M3yB6rzTiO
192,193,karpathy,"wow, blown away & hypnotized by results from Progressive Growing of GANs  https://www.youtube.com/watch?time_continue=1&v=XOxxPcy5Gr4 … & code on github: https://github.com/tkarras/progressive_growing_of_gans …"
193,194,fhuszar,"AlphaGo Zero: the Minimal Policy Improvement principle, connections to vector fields, EP, Contrastive Divergence http://www.inference.vc/alphago-zero-policy-improvement-and-vector-fields/ …"
194,195,karpathy,"Heard my name name dropped on the latest a16z podcast during my morning commute, wrt AI. Unfortunately they think I work at Google ;'("
195,196,karpathy,"Good & quick to the point reading: ""Introduction to High Performance Scientific Computing"" [book pdf]  http://pages.tacc.utexas.edu/~eijkhout/Articles/EijkhoutIntroToHPC.pdf …"
196,197,smerity,A fascinating discussion of Fermi Paradox / Drake Equation parameters that shifted my thinking on the matter 🙂 Link:  http://www.jodrellbank.manchester.ac.uk/media/eps/jodrell-bank-centre-for-astrophysics/news-and-events/2017/uksrn-slides/Anders-Sandberg---Dissolving-Fermi-Paradox-UKSRN.pdf … https://twitter.com/devonzuegel/status/920875810319343617 …
197,198,karpathy,"My fave part is that the prediction accuracy on professional moves goes up during training, and then eventually goes down a bit. Nice."
198,199,karpathy,"Should add that it's quite general, but within limits. Not all applications (most) allow a simulator and self-play https://medium.com/@karpathy/alphago-in-context-c47718cb95a5 …"
199,200,karpathy,"AlphaGo Zero  https://deepmind.com/blog/alphago-zero-learning-scratch/ … v cool based on skim: no sup pretraining, raw board input, resnet, new training scheme. more magic."
200,201,nathanbenaich,Welcome to Issue 21 - Part 1 of 2! 🤓 https://www.getrevue.co/profile/nathanbenaich/issues/nathan-ai-issue-21-part-1-2-july-october-2017-66346 …
201,202,karpathy,Stanford's EE380 Colloquium on Computer Systems videos https://www.youtube.com/playlist?list=PLoROMvodv4rMWw6rRoeSpkiseTHzWj6vu&disable_polymer=true …
202,203,karpathy,The heat expelled from the back of a computer makes me sad.
203,204,karpathy,"An uncharacteristically good discussion spotted on r/ML  https://www.reddit.com/r/MachineLearning/comments/75phd2/r_mixed_precision_training/?st=j8ntr6wo&sh=e59130db … TLDR: use trunc float32 (""bfloat16"") instead of float16"
204,205,openai,"AIs which develop faking, tackling, blocking, kicking through self-play: https://blog.openai.com/competitive-self-play/ …"
205,206,pabbeel,"Deep RL Bootcamp lecture videos and labs release  https://sites.google.com/view/deep-rl-bootcamp/lectures …! :)  [Organized by @pabbeel, Peter Chen, Rocky Duan, @karpathy]"
206,207,karpathy,@pedrordz wat
207,208,karpathy,Every noise at once  http://everynoise.com/engenremap.html  lays out all possible music in 2D + spotify samples. very cool.
208,209,karpathy,"I'm apparently quite late to the party, but I discovered a very good/thorough math YouTube channel; 3Blue1Brown: https://www.youtube.com/channel/UCYO_jab_esuFRV4b17AJtAw/featured …"
209,210,goodfellow_ian,Google Brain Residency has been upgraded to Google AI Residency. Now possible to work with more AI teams at Google. https://research.google.com/teams/brain/residency/ …
210,211,oriolvinyalsml,"WaveNet becomes the voice of Google Assistant! 1000x faster & better, brought to you by a neural net : )  https://deepmind.com/blog/wavenet-launches-google-assistant/ … pic.twitter.com/XaUkXTjBZp"
211,212,karpathy,"@KelloggsUS Hi, there are not enough raisins in your Raisin Bran. This is causing me significant distress."
212,213,openai,Deep linear networks can learn to perform nonlinear computation due to imprecision in floating point arithmetic: https://blog.openai.com/nonlinear-computation-in-linear-networks/ …
213,1,jeremyphoward,"Proud to be launching ""Introduction to Machine Learning for Coders"" today. If you're looking for a modern, code-first, opinionated introduction to machine learning, I think you might like this.  http://www.fast.ai/2018/09/26/ml-launch/ … pic.twitter.com/PxuEAU0c4V"
214,2,oriolvinyalsml,"Interesting papers using  http://github.com/deepmind/pysc2  showing the difficulty of StarCraft2 1vs1 for Deep RL (even w/ handcrafting & simplifications):  http://arxiv.org/abs/1809.09095 ,  http://arxiv.org/abs/1809.07193   Note that Blizzard AIs are easy to beat as human. Looking forward to more progress! pic.twitter.com/iHIIW5WSy8"
215,3,karpathy,"A report on the geopolitics of AI by @timhwang, especially found Part 3 interesting  https://arxiv.org/abs/1803.08971 , and the highly related ""U.S. Semiconductor Manufacturing: Industry Trends, Global Competition, Federal Policy""  https://fas.org/sgp/crs/misc/R44544.pdf …"
216,4,karpathy,"Growing as a programmer is to a large extent the accumulation of scars in your mind, which burn with each new line of code proportional to the expected pain inflicted on your future self over all possible refactoring."
217,5,karpathy,“The state of the art in explanation of a concept” - a phrase I first heard in a chat with @3blue1brown a while ago but has lingered with me since. Why shouldn’t there be an effort to seek/recognize such a thing for all concepts
218,6,karpathy,"My morning coffee turned out to be the difference between going and not going to NIPS 2018 this year. Apparently sold out in <15 minutes. I laughed at this diagram a year ago, but today it is too real. https://twitter.com/soumithchintala/status/909057642731130880 …"
219,7,karpathy,"Available video speeds on YouTube: 0, 0.25, 0.5, 0.75, 1.0, 1.25, 1.5, 2.0. What monster left out the 1.75x"
220,8,karpathy,“A Magazine Is an iPad That Does Not Work”  https://youtu.be/aXV-yaFmQNk  a fave video. As our technosphere becomes more advanced & pervasive it is increasingly difficult to distinguish it from raw physics. Eg one day it will be odd that there was a time you couldn’t talk to all objects
221,9,karpathy,Full Body Surrogacy for Collaborative Communication  https://www.youtube.com/watch?v=Nrc7gH6dydw … interesting
222,10,pytorch,"We're excited to host the first PyTorch Developer Conference, featuring talks, discussions and posters from the core-devs, academia and industry.  Date: Oct 2nd, 2018 in San Francisco.  Space is limited, apply for an invite at  https://pytorch.fbreg.com "
223,11,karpathy,"""Hybrid Optical-Electronic Convolutional Neural Networks""  http://www.computationalimaging.org/publications/hybrid-optical-electronic-convolutional-neural-networks/ … incredibly interesting work - develops a hybrid optoelectronic CNN with an optical CONV1 layer that operates at zero power consumption (with rest of the forward pass in electronics (for now))"
224,12,karpathy,"There was an interestingly prophetic short story that has left a lasting impression on me and now can’t find. It’s few decades old and describes a highly accelerated future with people going through multiple jobs, partners, and rich and bankrupt cycles each day. Rings any bells?"
225,13,jhnhw,"First 1e6 integers, represented as binary vectors indicating their prime factors, and laid out using the sparse matrix support in @leland_mcinnes's UMAP dimensionality reduction algorithm. This is from a 1000000x78628 (!) binary matrix. Very pretty structure emerges. pic.twitter.com/PF6slS2EO3"
226,14,ericjang11,"Incredible style pose transfer + generative models paper applied to dance videos. This is so cool, my fingers are trembling as I tweet this.  https://youtu.be/PCBTZh41Ris?t=2m13s … Paper:  https://arxiv.org/pdf/1808.07371.pdf …"
