,S.No.,tweetid,tweettext
332,120,elonmusk,"View from SpaceX Launch Control. Apparently, there is a car in orbit around Earth. pic.twitter.com/QljN2VnL1O"
333,121,spacex,Falcon Heavy side cores have landed at SpaceX’s Landing Zones 1 and 2. pic.twitter.com/oMBqizqnpI
334,122,spacex,Liftoff! pic.twitter.com/2ypESsi1sF
335,123,oriolvinyalsml,Evolution > RL (for now...) for architecture search. New SOTA on CIFAR10 (2.13% top 1) and ImageNet (3.8% top 5). 🔥 450 GPU / 7 days & 900 TPU / 5 days 🔥  https://arxiv.org/abs/1802.01548  pic.twitter.com/VgX1pUiqWX
336,124,elonmusk,Falcon Heavy sends a car to Mars https://youtu.be/Tk338VXcb24 
337,125,karpathy,"Getting fairly addicted to Anki as a result of this twitter thread from @michael_nielsen & few posts I've encountered in the past  https://www.gwern.net/Spaced-repetition …. Was easier than I expected to learn lots of countries/states/flags. Wish there were more ""open-sourced"" anki decks out there. https://twitter.com/michael_nielsen/status/957763229454774272 …"
338,126,karpathy,The Secret Life of Plankton  https://youtu.be/xFQ_fO2D7f0  i still can't quite wrap my head around our laws of physics apparently just resulting in the whole party
339,127,pabbeel,"ICLR accepted paper analysis by Arthur Pajot.  Berkeley coming in second after Google, followed by Stanford, CMU, Facebook, Microsoft, Oxford, IBM, Toronto, ETH, MIT, ...  Many other breakdowns, too + code  http://webia.lip6.fr/~pajot/dataviz.html … pic.twitter.com/mrNU0rxick"
340,128,karpathy,My iPhoneX switch has turned out to be a UX regression: - Face ID doesn't work: when phone is on table next to me. when I try to check it from bed in am hours. halfway through a yawn. leaning on my hand. - Often accidentally swipe to camera when I play with the phone in my hand
341,129,karpathy,DNA seen through the eyes of a coder  https://ds9a.nl/amazing-dna/  I like this a lot.
342,130,gwern,Best of 2017 links:  https://www.gwern.net/newsletter/2017/13 …
343,131,karpathy,"Instead trying to describe an architecture in a paper with words, tables and diagrams across 2 sections and 4 pages, it is 90% of the time possible to just paste the 100 lines of code into Appendix A."
344,132,pytorch,"We are a year old :) A post looking back at our journey, the lovely community, the engineering and love.  http://pytorch.org/2018/01/19/a-year-in.html …"
345,133,karpathy,UC Berkeley EECS Colloquium talk on GraphCore's Colossus IPU https://www.youtube.com/watch?v=7XtBZ4Hsi_M …
346,134,karpathy,"faster-rcnn.pytorch  https://github.com/jwyang/faster-rcnn.pytorch … object detection is deceivingly highly error-prone, tricky, and labor intensive to get right. Great to see nice, open source, and evaluated implementations."
347,135,cademetz,"How big is the sudden explosion of startups building AI chips? There are 45 of them, and at least five have raised $100 million: https://nyti.ms/2EEpICX "
348,136,hardmaru,KaTeX is so much better than MathJax  https://khan.github.io/KaTeX/ 
349,137,karpathy,"A long while ago I came across a great document describing the human brain strictly as a computing device, from a computer scientist / systems perspective. Can't find anymore ;( (trying to Google it is only surfacing Neuralink news articles...)"
350,138,karpathy,Reading Silicon: How to Reverse Engineer Integrated Circuits  https://www.youtube.com/watch?v=aHx-XUA6f9g … wow. I felt proud reverse engineering x86 binaries and was unaware of this next level.
351,139,karpathy,"Curiously, the dynamics of this system are such that when you bombard hot earth stuff with photons for a while, it eventually transforms into intricate molecular fractal patterns of vegetation, humans/animals, cities, cars, chips etc. must look funny “zoomed out” & played forward"
352,140,karpathy,"Black Mirror Season 4: 1. ""Hang the DJ"" - fun twist 2. ""USS Callister"" - entertaining but unrealistic 3. ""Arkangel"" - good ""well-intentioned tech gone wrong"" story 4. ""Black Museum"" - trying a bit too hard 5. ""Crocodile"" - well that escalated quickly 6. ""Metalhead"" - yeeeeahno"
353,141,karpathy,Cool analysis (but overall a bit of a missed opportunity) from RescueTime on productivity trends  http://blog.rescuetime.com/225-million-hours-productivity/ … I like the peak productive for software eng chart. (During PhD I did most of my most productive work at 3am. Now forced to adopt normal working hours :( )
354,142,karpathy,Basically everything is rated in range of 3.5-4.2 out of 5.
355,143,oriolvinyalsml,"""Optimal"" running, brought to you by Deep RL.  https://arxiv.org/abs/1801.00690  pic.twitter.com/Sln3HO68Ot"
356,144,dennybritz,I wrote up a (not so brief) summary of AI developments that stood out to me in 2017 http://www.wildml.com/2017/12/ai-and-deep-learning-in-2017-a-year-in-review/ …
357,145,laurademing,Sorry for the late posting! I made a research primer ( http://ldeming.com/longevityfaq ) - would love any feedback/thoughts/comments.
358,146,karpathy,China Shuts Down Its Legal Ivory Trade  https://news.nationalgeographic.com/2017/12/wildlife-watch-china-ivory-ban-goes-into-effect/ … prices of ivory drop 65%. %chance of a good future += 0.0001
359,147,spacex,A Red Car for the Red Planet  http://instagram.com/p/BdA94kVgQhU  pic.twitter.com/440bvUHJeO
360,148,tim_dettmers,@nvidia Deep learning hardware limbo is the battle between @Nvidia vs @AMD vs @IntelNervana for the throne of deep learning hardware. Learn who might win and why  http://timdettmers.com/2017/12/21/deep-learning-hardware-limbo/ … #dlearn #nlproc #ai
361,149,zzznah,My submissions for #nips4creativity are here  http://nips4creativity.com/art/alexander-mordinvtsev/ … pic.twitter.com/KJtnjYViAo
362,150,karpathy,"Visual Domain Decathlon - classify 10 datasets at the same time  http://www.robots.ox.ac.uk/~vgg/decathlon/  a fun setup, brings some problems that are rare in academia but common in industry to the forefront, e.g. large data imbalances, multi-task learning, forgetting, domain adaptation"
363,151,jeffdean,Slides from my talk in yesterday's ML Systems workshop are now up at   http://learningsys.org/nips17/assets/slides/dean-nips17.pdf … #NIPS2017
364,152,jeffdean,"@GoogleResearch If you're interested in learning to do machine learning research, you should investigate the Google AI Residency program.  Applications are due Jan. 8.  @GoogleBrain @googleresearch https://twitter.com/viegasf/status/940424861847080960 …"
365,153,richardsocher, http://johnguerra.co/viz/influentials/NIPS2017/ … Interesting visualization of how much Twitter-based influence/mindshare people/organizations have on the field of #ArtificialIntelligence right now. #NIPS2017 pic.twitter.com/YIHGo98StW
366,154,chrmanning,"Machine Learning just ate Algorithms in one large bite, thx to @tim_kraska, @alexbeutel, @edchi, @JeffDean  & Polyzotis at @Google—faster, smaller trees, hashes, bloom filters  https://www.arxiv-vanity.com/papers/1712.01208v1/ … pic.twitter.com/BcQzOFQrYu"
367,155,fchollet,"My book Deep Learning with Python has been officially released yesterday -- it's now shipping. 384 pages of deep learning, with a crisp smell of freshly printed paper. The coupon code CTWNIPS17 is still active for now (40% off at checkout).  https://www.manning.com/books/deep-learning-with-python?a_aid=keras&a_bid=76564dff … pic.twitter.com/mesC9RXCWd"
368,156,haldaume3,".@ylecun replies to Ali Rahimi's ""alchemy"" and Ali replies to that. v nice!  my opinion is empirical work is great w/o proving things (I do mostly that) but I am quite allergic to the practice of bandage mountains ""just cuz"" for dealing w flaws, rather than going fixing the flaws pic.twitter.com/xMt7UOcKnb"
369,157,ctnzr,"People have been asking for a fast open source CUDA matrix multiplication for ages. My colleagues just released one! In many cases, it’s just as fast as CUBLAS. Works on Volta’s tensor cores, too. https://devblogs.nvidia.com/parallelforall/cutlass-linear-algebra-cuda/ …"
370,158,karpathy,Block-Sparse GPU Kernels release from OpenAI https://blog.openai.com/block-sparse-gpu-kernels/ …
371,159,karpathy,"Some strong results reported in Chess from AlphaZero (an AlphaGo generalization)  https://arxiv.org/abs/1712.01815  winning against a 64 thread 1GB hash Stockfish 28-72-0. Not obvious if it's a comparable ""compute footing"", but the games are fun to step through:  https://lichess.org/study/EOddRjJ8 "
372,160,pytorch,"New release[v0.3.0]: Performance improvements, new layers, ship models to other frameworks (via ONNX), CUDA9, CuDNNv7, lots of bug fixes Read our detailed release notes here:  https://github.com/pytorch/pytorch/releases/tag/v0.3.0 … Install the latest version using updated commands from http://pytorch.org "
373,161,seb_ruder,New blog post: Optimization for Deep Learning Highlights in 2017 http://ruder.io/deep-learning-optimization-2017/index.html …
374,162,karpathy,To friends attending NIPS: we'd like to invite you to our AI fireside chat and party!  Starts at 7pm tonight. If you’d like to join email conversation@tesla.com with your name/affiliation and we’ll do our best to get as many people in as possible! pic.twitter.com/Cth9lrJpss
375,163,karpathy,"HoME: a Household Multimodal Environment  https://home-platform.github.io/  looks pretty cool! vision, audio, semantics, physics, and interaction with objects and other agents & open-source, OpenAI Gym-compatible."
376,164,karpathy,"Wow, GANs are on a roll. Quite amazing results from pix2pixHD:  https://tcwang0509.github.io/pix2pixHD/  Also the most tangible glimpse so far into what I keep referring to as a future Photoshop 2.0"
377,165,goodfellow_ian,"ML researchers, reviewers, and press coverage of ML need to get a lot more serious about statistically robustness of results and the effect of hyperparameters. This study shows that many papers over the last year or so were just observing sampling error, not true improvement. https://twitter.com/karol_kurach/status/935782566291894272 …"
378,166,oriolvinyalsml,Great stuff from @maxjaderberg et al on hyperparameter search based on evolving populations that actually outperforms random search!  https://deepmind.com/blog/population-based-training-neural-networks/ … pic.twitter.com/rgDIU86SuR
379,167,karpathy,Randomly picked up this beauty from an artist on a street market. pic.twitter.com/4fKTcIoOgB
380,168,karpathy,Haha! :) And I thought I'd have to stay in physics if I wanted my own constants. https://twitter.com/fhuszar/status/933683427894841345 …
381,169,tesla, http://Tesla.com/roadster  pic.twitter.com/pyoDmOj4XC
382,170,jackclarksf,Untethered 'Atlas' robot backflip. Pretty incredible stuff from Boston Dynamics.   https://youtu.be/fRj34o4hN4I  pic.twitter.com/Nc8kf7O2gn
383,171,openai,Are you a programmer who wants to get into deep learning? Apply to our Machine Learning Fellow role: https://openai.com/jobs/#lever-54ddfefe-6483-4bba-a828-11a156eae7eb …
384,172,reza_zadeh,The New Computing Stack:  - GPUs/TPUs are eating Linear Algebra. - Linear Algebra is eating Deep Learning. - Deep Learning is eating Machine Learning.  - Machine Learning is eating Artificial Intelligence (AI). - AI is eating Software. - Software is eating the world.
385,173,karpathy,"Very good reading from Rodney Brooks ""The seven deadly sins of predicting the future of AI""  https://rodneybrooks.com/the-seven-deadly-sins-of-predicting-the-future-of-ai …"
386,174,soumithchintala,"use gradient magnitude as a signal for gradient importance.  Sort your gradients, find a threshold, clip your gradients,  exchange sparse gradients, win.  https://openreview.net/pdf?id=SkhQHMW0W … pic.twitter.com/sNChdqCCjm"
387,175,hardmaru,Evolution Strategy Variant + OpenAI Gym pic.twitter.com/t2R0QQ5qcH
388,176,petewarden,Deep Learning is Eating Software -  http://petewarden.com/2017/11/13/deep-learning-is-eating-software/ … - a post inspired by chatting with @karpathy about Software 2.0!
389,177,karpathy,"New blog post: ""Software 2.0"" https://medium.com/@karpathy/software-2-0-a64152b37c35 …"
390,178,quasimondo,Facefeedback II pic.twitter.com/XuFlNWGJ7r
391,179,hnisimasu,Single-molecule movie of DNA search and cleavage by CRISPR-Cas9. pic.twitter.com/3NQxmbvzJF
392,180,sla,"Preferred Networks achieved 74.9% accuracy on ImageNet training in 15min, the world's fastest result using ChainerMN and 1,024 P100 GPUs.  https://www.preferred-networks.jp/en/news/pr20171110 … Paper is available.  https://www.preferred-networks.jp/docs/imagenet_in_15min.pdf …"
393,181,gabormelis,Give your baselines some love and they might surprise you:  https://arxiv.org/abs/1707.05589 
394,182,karpathy,"Google released NASNet in TF a ~week ago, which is exciting  https://github.com/tensorflow/models/tree/master/research/slim/nets/nasnet … the code is a bit difficult to parse but it's nice to have the models. Impressive speed-accuracy tradeoffs."
395,183,ch402,What do neural nets see? You may be surprised. @zzznah @ludwigschubert & I explore.  https://distill.pub/2017/feature-visualization/ … pic.twitter.com/9uOL6uF2HA
396,184,jeremyphoward,Very handy reference to relative Imagenet performance of many recent architectures  https://github.com/Cadene/pretrained-models.pytorch … pic.twitter.com/DD5ui1lsgS
397,185,karpathy,"TensorFlow Eager  https://research.googleblog.com/2017/10/eager-execution-imperative-define-by.html … now more like Chainer, as a response to PyTorch"
398,186,hardmaru,Mixup: Beyond Empirical Risk Minimization. Use random linear interpolation for data & labels to increase robustness of network. Clever idea! pic.twitter.com/fYoEYJTlFN
399,187,karpathy,Efficient Processing of Deep Neural Networks: A Tutorial and Survey  https://arxiv.org/abs/1703.09039  good reading.
400,188,karpathy,"""Why Snapchat Spectacles failed""  https://news.ycombinator.com/item?id=15576751 … I had both Google Glass & Spectacles. They were ""pretty cool"", like VR, Kinect etc."
401,189,quasimondo,Looks like nobody reads the README. There is a 1 hour clip of @nvidias's generated faces with just 166 views: https://www.youtube.com/watch?v=36lE9tV9vm0 …
402,190,karpathy,"""DeepLearning11: 10x NVIDIA GTX 1080 Ti Single Root Deep Learning Server."" That's a lot of firepower for $16K https://www.servethehome.com/deeplearning11-10x-nvidia-gtx-1080-ti-single-root-deep-learning-server-part-1/#comments …"
403,191,karpathy,"There are only a few things that compete for top spots on my ""what would I do with an exaflop computer"". This is now up there."
404,192,karpathy,0_o pic.twitter.com/M3yB6rzTiO
405,193,karpathy,"wow, blown away & hypnotized by results from Progressive Growing of GANs  https://www.youtube.com/watch?time_continue=1&v=XOxxPcy5Gr4 … & code on github: https://github.com/tkarras/progressive_growing_of_gans …"
406,194,fhuszar,"AlphaGo Zero: the Minimal Policy Improvement principle, connections to vector fields, EP, Contrastive Divergence http://www.inference.vc/alphago-zero-policy-improvement-and-vector-fields/ …"
407,195,karpathy,"Heard my name name dropped on the latest a16z podcast during my morning commute, wrt AI. Unfortunately they think I work at Google ;'("
408,196,karpathy,"Good & quick to the point reading: ""Introduction to High Performance Scientific Computing"" [book pdf]  http://pages.tacc.utexas.edu/~eijkhout/Articles/EijkhoutIntroToHPC.pdf …"
409,197,smerity,A fascinating discussion of Fermi Paradox / Drake Equation parameters that shifted my thinking on the matter 🙂 Link:  http://www.jodrellbank.manchester.ac.uk/media/eps/jodrell-bank-centre-for-astrophysics/news-and-events/2017/uksrn-slides/Anders-Sandberg---Dissolving-Fermi-Paradox-UKSRN.pdf … https://twitter.com/devonzuegel/status/920875810319343617 …
410,198,karpathy,"My fave part is that the prediction accuracy on professional moves goes up during training, and then eventually goes down a bit. Nice."
411,199,karpathy,"Should add that it's quite general, but within limits. Not all applications (most) allow a simulator and self-play https://medium.com/@karpathy/alphago-in-context-c47718cb95a5 …"
412,200,karpathy,"AlphaGo Zero  https://deepmind.com/blog/alphago-zero-learning-scratch/ … v cool based on skim: no sup pretraining, raw board input, resnet, new training scheme. more magic."
